Geografia;La estatua de la libertad, ¿se encuentra en New York?;true;1
Historia;La independencia argentina se firmo en 1816;true;1
Deportes;El superclasico en la copa argentina es entre river y sacachispas;false;1
Deportes;En el mundial de futbol de 1986 gano la seleccion argentina;true;1
Historia;La independencia se declaro en 1810;false;1
Historia;El ultimo gobierno de facto duro 3 años;false;1
Historia;El gobierno Kirchnerista duro 12 años;true;1
Geografia;Solo hay 3 continentes;false;1
